{
  "$schema": "https://configonaut.app/schemas/catalog-v1.json",
  "version": "1.1.0",
  "generatedAt": "2026-04-12",
  "source": "https://github.com/aaronjellis/configonaut-catalog",
  "categories": [
    {
      "id": "reference",
      "label": "Reference",
      "icon": "sparkles",
      "description": "Official reference servers from Anthropic."
    },
    {
      "id": "development",
      "label": "Developer Tools",
      "icon": "code",
      "description": "Source control, CI/CD, and code platforms."
    },
    {
      "id": "database",
      "label": "Databases",
      "icon": "database",
      "description": "SQL, NoSQL, and data warehouses."
    },
    {
      "id": "cloud",
      "label": "Cloud & Infra",
      "icon": "cloud",
      "description": "Hosting, compute, and cloud platforms."
    },
    {
      "id": "browser",
      "label": "Browser & Web",
      "icon": "globe",
      "description": "Web automation, scraping, and fetching."
    },
    {
      "id": "search",
      "label": "Search & Research",
      "icon": "search",
      "description": "Web search and research APIs."
    },
    {
      "id": "productivity",
      "label": "Productivity",
      "icon": "briefcase",
      "description": "Notes, tasks, and knowledge management."
    },
    {
      "id": "communication",
      "label": "Communication",
      "icon": "message-circle",
      "description": "Chat, email, and messaging platforms."
    },
    {
      "id": "design",
      "label": "Design",
      "icon": "palette",
      "description": "Figma, Canva, and design tools."
    },
    {
      "id": "monitoring",
      "label": "Monitoring",
      "icon": "activity",
      "description": "Observability, logs, and incident response."
    },
    {
      "id": "finance",
      "label": "Finance & Payments",
      "icon": "dollar-sign",
      "description": "Stripe, billing, and payment APIs."
    },
    {
      "id": "ai",
      "label": "AI & ML",
      "icon": "cpu",
      "description": "Model providers and inference tools."
    },
    {
      "id": "media",
      "label": "Media",
      "icon": "music",
      "description": "Audio, video, and image generation."
    },
    {
      "id": "crm",
      "label": "CRM & Sales",
      "icon": "users",
      "description": "Customer and sales platforms."
    },
    {
      "id": "filesystem",
      "label": "Local Files",
      "icon": "folder",
      "description": "Local file system and editor integration."
    }
  ],
  "servers": [
    {
      "id": "filesystem",
      "name": "Filesystem",
      "description": "Read, search, and manage local files securely.",
      "category": "reference",
      "tags": [
        "files",
        "filesystem",
        "local"
      ],
      "publisher": {
        "name": "Anthropic",
        "type": "vendor",
        "verified": true
      },
      "homepage": "https://github.com/modelcontextprotocol/servers",
      "repository": "https://github.com/modelcontextprotocol/servers",
      "license": "MIT",
      "popularity": 9,
      "transport": "stdio",
      "config": {
        "command": "npx",
        "args": [
          "-y",
          "@modelcontextprotocol/server-filesystem",
          "{{paths}}"
        ]
      },
      "requirements": [
        "node"
      ],
      "prerequisites": [
        {
          "type": "node"
        }
      ],
      "install": [
        {
          "type": "npmWarmup",
          "package": "@modelcontextprotocol/server-filesystem"
        }
      ],
      "configFields": [
        {
          "name": "paths",
          "kind": "argSpread",
          "type": "pathArray",
          "label": "Allowed paths",
          "description": "Directories the server can read/write.",
          "required": true
        }
      ]
    },
    {
      "id": "fetch",
      "name": "Fetch",
      "description": "Fetch and convert web content for LLM consumption.",
      "category": "reference",
      "tags": [
        "fetch",
        "web",
        "http"
      ],
      "publisher": {
        "name": "Anthropic",
        "type": "vendor",
        "verified": true
      },
      "homepage": "https://github.com/modelcontextprotocol/servers",
      "repository": "https://github.com/modelcontextprotocol/servers",
      "license": "MIT",
      "popularity": 8,
      "transport": "stdio",
      "config": {
        "command": "uvx",
        "args": [
          "mcp-server-fetch"
        ]
      },
      "requirements": [
        "python",
        "uv"
      ],
      "prerequisites": [
        {
          "type": "uv"
        }
      ],
      "install": [
        {
          "type": "uvxWarmup",
          "package": "mcp-server-fetch"
        }
      ]
    },
    {
      "id": "git",
      "name": "Git",
      "description": "Read and search local Git repositories.",
      "category": "reference",
      "tags": [
        "git",
        "version-control"
      ],
      "publisher": {
        "name": "Anthropic",
        "type": "vendor",
        "verified": true
      },
      "homepage": "https://github.com/modelcontextprotocol/servers",
      "repository": "https://github.com/modelcontextprotocol/servers",
      "license": "MIT",
      "popularity": 7,
      "transport": "stdio",
      "config": {
        "command": "uvx",
        "args": [
          "mcp-server-git",
          "--repository",
          "{{repositoryPath}}"
        ]
      },
      "requirements": [
        "python",
        "uv"
      ],
      "prerequisites": [
        {
          "type": "uv"
        }
      ],
      "install": [
        {
          "type": "uvxWarmup",
          "package": "mcp-server-git"
        }
      ],
      "configFields": [
        {
          "name": "repositoryPath",
          "kind": "arg",
          "type": "path",
          "label": "Repository path",
          "description": "Path to the local Git repository.",
          "required": true
        }
      ]
    },
    {
      "id": "memory",
      "name": "Memory",
      "description": "Persistent memory using a local knowledge graph.",
      "category": "reference",
      "tags": [
        "memory",
        "knowledge-graph"
      ],
      "publisher": {
        "name": "Anthropic",
        "type": "vendor",
        "verified": true
      },
      "homepage": "https://github.com/modelcontextprotocol/servers",
      "repository": "https://github.com/modelcontextprotocol/servers",
      "license": "MIT",
      "popularity": 7,
      "transport": "stdio",
      "config": {
        "command": "npx",
        "args": [
          "-y",
          "@modelcontextprotocol/server-memory"
        ]
      },
      "requirements": [
        "node"
      ],
      "prerequisites": [
        {
          "type": "node"
        }
      ],
      "install": [
        {
          "type": "npmWarmup",
          "package": "@modelcontextprotocol/server-memory"
        }
      ]
    },
    {
      "id": "sequential-thinking",
      "name": "Sequential Thinking",
      "description": "Dynamic problem-solving through thought sequences.",
      "category": "reference",
      "tags": [
        "thinking",
        "reasoning"
      ],
      "publisher": {
        "name": "Anthropic",
        "type": "vendor",
        "verified": true
      },
      "homepage": "https://github.com/modelcontextprotocol/servers",
      "repository": "https://github.com/modelcontextprotocol/servers",
      "license": "MIT",
      "popularity": 6,
      "transport": "stdio",
      "config": {
        "command": "npx",
        "args": [
          "-y",
          "@modelcontextprotocol/server-sequential-thinking"
        ]
      },
      "requirements": [
        "node"
      ],
      "prerequisites": [
        {
          "type": "node"
        }
      ],
      "install": [
        {
          "type": "npmWarmup",
          "package": "@modelcontextprotocol/server-sequential-thinking"
        }
      ]
    },
    {
      "id": "time",
      "name": "Time",
      "description": "Time and timezone conversion utilities.",
      "category": "reference",
      "tags": [
        "time",
        "timezone"
      ],
      "publisher": {
        "name": "Anthropic",
        "type": "vendor",
        "verified": true
      },
      "homepage": "https://github.com/modelcontextprotocol/servers",
      "repository": "https://github.com/modelcontextprotocol/servers",
      "license": "MIT",
      "popularity": 4,
      "transport": "stdio",
      "config": {
        "command": "uvx",
        "args": [
          "mcp-server-time"
        ]
      },
      "requirements": [
        "python",
        "uv"
      ],
      "prerequisites": [
        {
          "type": "uv"
        }
      ],
      "install": [
        {
          "type": "uvxWarmup",
          "package": "mcp-server-time"
        }
      ]
    },
    {
      "id": "everything",
      "name": "Everything",
      "description": "Test server exercising all MCP features.",
      "category": "reference",
      "tags": [
        "testing",
        "demo"
      ],
      "publisher": {
        "name": "Anthropic",
        "type": "vendor",
        "verified": true
      },
      "homepage": "https://github.com/modelcontextprotocol/servers",
      "repository": "https://github.com/modelcontextprotocol/servers",
      "license": "MIT",
      "popularity": 3,
      "transport": "stdio",
      "config": {
        "command": "npx",
        "args": [
          "-y",
          "@modelcontextprotocol/server-everything"
        ]
      },
      "requirements": [
        "node"
      ],
      "prerequisites": [
        {
          "type": "node"
        }
      ],
      "install": [
        {
          "type": "npmWarmup",
          "package": "@modelcontextprotocol/server-everything"
        }
      ]
    },
    {
      "id": "github",
      "name": "GitHub",
      "description": "Official GitHub MCP server. Create issues, manage PRs, search code, and more.",
      "category": "development",